Imply,https://www.crunchbase.com/organization/imply-data,"Burlingame, California, United States",Imply is a multi-cloud data platform designed to deliver real-time ingestion and visualizations for event-driven and streaming data flows.,"Analytics, Big Data, Data Visualization, Enterprise Software, Information Technology","30,011",,,5,Late Stage Venture,2022-05-17,100000000,USD,100000000,Series D,100000000,USD,100000000,215300000,USD,215300000,Series D,215300000,USD,215300000,"Andreessen Horowitz, Khosla Ventures, Bessemer Venture Partners, Tiger Global Management, Thoma Bravo",2015-01-01,year,Active
PointClickCare,https://www.crunchbase.com/organization/pointclickcare,"Mississauga, Ontario, Canada",PointClickCare develops web-based products and services to help long-term care providers manage the complete lifecycle of resident care.,"Elder Care, Enterprise Software, Health Care, SaaS, Software, Web Browsers","30,043",,,5,Private Equity,2022-04-01,,,,Secondary Market,,,,297000000,CAD,229978523,Private Equity,297000000,CAD,229978523,"Dragoneer Investment Group, JMI Equity, Hellman & Friedman",1995-01-01,year,Active
Lucid Software,https://www.crunchbase.com/organization/lucidchart,"South Jordan, Utah, United States",Lucid is a visual collaboration suite that helps teams see and build the future from idea to reality.,"Collaboration, Enterprise Software, Information Services, Information Technology, Internet, Mobile, Mobile Apps, SaaS, Software","30,046",,,8,Late Stage Venture,2021-06-24,500000000,USD,500000000,Secondary Market,,,,170462414,USD,170462414,Series E,670462414,USD,670462414,"500 Global, ICONIQ Growth, Google Ventures, Peterson Ventures, Spectrum Equity",2010-09-03,day,Active
Back Market,https://www.crunchbase.com/organization/back-market,"Paris, Ile-de-France, France",Back Market is an online marketplace for refurbished electronics.,"Consumer Electronics, E-Commerce, Marketplace","30,049",,,6,Late Stage Venture,2022-01-11,448400000,EUR,509651438,Series E,448400000,EUR,509651438,1023349031,USD,1023349031,Series E,1023349031,USD,1023349031,"Eurazeo, Goldman Sachs, Aglaé Ventures, General Atlantic, Generation Investment Management",2014-01-01,year,Active
Yaoshibang,https://www.crunchbase.com/organization/yaoshibang,"Guangzhou, Guangdong, China",Yaoshibang is a Chinese B2B pharmaceutical trading platform.,"B2B, Pharmaceutical, Trading Platform","30,055",2023-06-30,day,5,IPO,2021-06-15,270000000,USD,270000000,Series E,270000000,USD,270000000,495592477,USD,495592477,Series E,495592477,USD,495592477,"Fosun International, Fosun Pharma, DCM Ventures, Baidu, Shunwei Capital",2015-01-01,year,Active
Solugen,https://www.crunchbase.com/organization/solugen,"Houston, Texas, United States",Solugen is a carbon negative moleucle factory that replaces petroleum-based products with plant-derived substitutes.,"Biopharma, Biotechnology, Chemical, GreenTech, Manufacturing","30,063",,,9,Late Stage Venture,2022-10-28,200000000,USD,200000000,Series D,200000000,USD,200000000,642171000,USD,642171000,Series D,642171000,USD,642171000,"Massachusetts Institute of Technology, Y Combinator, Lowercarbon Capital, Soma Capital, BlackRock",2016-01-01,year,Active
CircleCI,https://www.crunchbase.com/organization/circle-ci,"San Francisco, California, United States",CircleCI is a continuous integration and delivery platform that automates development workflows and IT operations.,"Delivery, Delivery Service, Developer Tools, PaaS, Productivity Tools, SaaS, Software","30,067",,,9,Late Stage Venture,2021-05-11,100000000,USD,100000000,Series F,100000000,USD,100000000,315000000,USD,315000000,Series F,315000000,USD,315000000,"500 Global, DCVC, Sapphire Ventures, Scale Venture Partners, Industry Ventures",2011-01-01,year,Active
NotCo,https://www.crunchbase.com/organization/the-not-company,"Santiago, Region Metropolitana, Chile",NotCo is a food tech company that uses artificial intelligence to create food from plants.,"Alternative Protein, Artificial Intelligence (AI), Food and Beverage, Food Processing","30,069",,,7,Late Stage Venture,2022-12-12,70000000,USD,70000000,Series D,70000000,USD,70000000,432999995,USD,432999995,Series D,432999995,USD,432999995,"General Catalyst, IndieBio, L Catterton, DFJ Growth, Tiger Global Management",2015-01-01,year,Active
Lanhu,https://www.crunchbase.com/organization/lanhu,"Beijing, Beijing, China",Lanhu is a product design platform.,"Enterprise Resource Planning (ERP), Product Design, Software","30,099",,,4,Late Stage Venture,2021-10-23,1000000000,CNY,156619524,Series C,1000000000,CNY,156619524,1500000000,CNY,233845565,Series C,1500000000,CNY,233845565,"Sequoia Capital China, Lightspeed China Partners, GGV Capital, GSR Ventures",2015-01-01,day,Active
BigPanda,https://www.crunchbase.com/organization/bigpanda,"Mountain View, California, United States","BigPanda offers a platform that helps IT Ops, NOC, and DevOps teams detect, investigate, and resolve IT incidents faster and more easily.","Cloud Infrastructure, Cyber Security, Developer Platform, DevOps, Enterprise Software, Information Technology, SaaS","30,116",,,8,Late Stage Venture,2022-08-17,20000000,USD,20000000,Series E,20000000,USD,20000000,337000000,USD,337000000,Series E,337000000,USD,337000000,"UBS, Sequoia Capital, Insight Partners, TPG Growth, Greenfield Partners",2012-01-01,year,Active
TradingView,https://www.crunchbase.com/organization/tradingview,"London, England, United Kingdom","TradingView provides traders and investors with charts, tools, and social networking.","Analytics, Cloud Computing, Finance, FinTech, Stock Exchanges, Trading Platform","30,117",,,10,Late Stage Venture,2023-01-20,,,,Secondary Market,298000000,USD,298000000,338652500,USD,338652500,Series C,338752500,USD,338752500,"Techstars, Right Side Capital Management, Insight Partners, J. Hunt Holdings, Tiger Global Management",2011-09-01,day,Active
eSign,https://www.crunchbase.com/organization/esign-4ff9,"Hangzhou, Zhejiang, China","eSign is a market leader in electronic signatures offering services to corporations, government service systems, and individual users.","E-Signature, Enterprise, Privacy, Security","30,123",,,1,Late Stage Venture,2021-09-13,1200000000,CNY,185994606,Series E,1200000000,CNY,185994606,1200000000,CNY,185994606,Series E,1200000000,CNY,185994606,"Sequoia Capital China, Fortune Venture Capital, IDG Capital, Hidden Hill Capital, Grand Flight Investment",2002-01-01,year,Active
Commonwealth Fusion,https://www.crunchbase.com/organization/commonwealth-fusion-systems,"Cambridge, Massachusetts, United States",Commonwealth Fusion is an MIT spinoff research company that focuses on bringing fusion energy technology to the market.,"Clean Energy, Electrical Distribution, Energy, Environmental Engineering, Renewable Energy","30,132",,,5,Early Stage Venture,2023-05-31,,,,Grant,1800000000,USD,1800000000,1999000000,USD,1999000000,Series B,1999000000,USD,1999000000,"FootPrint Coalition, US Department of Energy, Breakthrough Energy Ventures, Google, Lowercarbon Capital",2017-01-01,year,Active
CaptivateIQ,https://www.crunchbase.com/organization/captivateiq,"San Francisco, California, United States",CaptivateIQ develops a sales compensation platform designed to help businesses leverage the power of incentives to motivate teams.,"Data Integration, Management Information Systems, SaaS, Sales, Software","30,157",,,5,Late Stage Venture,2022-01-26,100000000,USD,100000000,Series C,100000000,USD,100000000,164600000,USD,164600000,Series C,164600000,USD,164600000,"Y Combinator, Sequoia Capital, Foundation Capital, ICONIQ Growth, Sapphire Ventures",2017-01-01,year,Active
Wealthsimple,https://www.crunchbase.com/organization/wealthsimple,"Toronto, Ontario, Canada",Wealthsimple offers financial tools to help investors grow and manage their money.,"Finance, Financial Services, FinTech, Impact Investing, Personal Finance, Wealth Management","30,162",,,9,Private Equity,2021-05-03,750000000,CAD,610774054,Private Equity,750000000,CAD,610774054,1130900000,CAD,900409434,Private Equity,1130900000,CAD,900409434,"TCV, ICONIQ Growth, Inovia Capital, Dragoneer Investment Group, Meritech Capital Partners",2014-01-01,day,Active
Skims,https://www.crunchbase.com/organization/skims,"Culver City, California, United States","SKIMS is a solutions oriented brand creating the next generation of inclusive underwear, loungewear and shapewear.","Fashion, Lingerie, Retail","30,253",,,5,Late Stage Venture,2023-07-19,270000000,USD,270000000,Series C,270000000,USD,270000000,701000090,USD,701000090,Series C,701000090,USD,701000090,"Thrive Capital, Wellington Management, Imaginary Ventures, Lone Pine Capital, Alliance Consumer Growth",2019-01-01,year,Active
Chief,https://www.crunchbase.com/organization/chief-6603,"New York, New York, United States",Chief is a private membership network focused on connecting and supporting women executive leaders.,"Communities, Education, Professional Networking, Social Media, Social Network, Women's","30,281",,,4,Early Stage Venture,2022-03-31,100000000,USD,100000000,Series B,100000000,USD,100000000,140000000,USD,140000000,Series B,140000000,USD,140000000,"Notable Capital, General Catalyst, Primary Venture Partners, CapitalG, TQ Ventures",2019-01-01,year,Active
Qiniu,https://www.crunchbase.com/organization/qiniu,"Shanghai, Shanghai, China",Your unified data lake and analysis platform for 5G,"Cloud Computing, Cloud Storage, Information Technology, Intelligent Systems","30,332",,,7,Late Stage Venture,2020-06-16,1000000000,CNY,141103428,Series F,1000000000,CNY,141103428,396890187,USD,396890187,Series F,396890187,USD,396890187,"Qiming Venture Partners, Telstra Ventures, Matrix Partners China, YF Capital, China Structural Reform Fund",2011-01-01,year,Active
United Aircraft,https://www.crunchbase.com/organization/united-aircraft-68e4,"Shenzhen, Guangdong, China","United Aircraft specializes in the research, development, manufacturing, and service of drones and other equipment.","Drone Management, Drones, Electronics, Manufacturing","30,357",,,2,Late Stage Venture,2023-06-19,1200000000,CNY,167562661,Series D,1200000000,CNY,167562661,3200000000,CNY,458619927,Series D,3200000000,CNY,458619927,"Cornerstone Capital, Chengdu Heavy Industry Qingyue Fund, Gongchuang Venture Capital, Harbin Venture Capital, Keli Investments",2006-01-01,year,Active
Hyperchain Technologies,https://www.crunchbase.com/organization/qulian-technology,"Hangzhou, Zhejiang, China",Hyperchain is a blockchain platform developer based in china.,"Blockchain, Computer, Enterprise Software","30,373",,,4,Late Stage Venture,2021-04-30,100000000,CNY,15445208,Series C,100000000,CNY,15445208,1600000000,CNY,249534911,Series C,1600000000,CNY,249534911,"Fosun International, E Fund Management Co.,LTD., Sunyard, China SDIC Gaoxin, Xinhu Zhongbao Co Ltd",2016-01-01,year,Active
Huitongda,https://www.crunchbase.com/organization/huitongda,"Nanjing, Jiangsu, China",Huitongda is a Chinese logistics service company providing home appliance supply chain services for the township market.,"E-Commerce, Home Appliances, Logistics, Retail, Supply Chain Management","30,392",,,6,Late Stage Venture,2021-05-19,,,,Series E,,,,6300000000,CNY,996246806,Series E,6300000000,CNY,996246806,"Alibaba Group, Addor Capital, SDIC Venture Capital, China Merchants Bank, New Horizon Capital",2010-01-01,year,Active
Job&Talent,https://www.crunchbase.com/organization/jobandtalent,"Madrid, Madrid, Spain",Jobandtalent is an online staffing marketplace for finding and filling gig-type jobs.,"Employment, Marketplace, Staffing Agency","30,455",,,18,Late Stage Venture,2022-05-05,250000000,USD,250000000,Debt Financing,500000000,USD,500000000,889753324,USD,889753324,Series E,1332995449,USD,1332995449,"Citi, Goldman Sachs, Spotahome, BlackRock, Wallapop",2009-01-01,year,Active
LeadSquared,https://www.crunchbase.com/organization/leadsquared,"Bangalore, Karnataka, India","LeadSquared is a sales execution and marketing automation platform that allows businesses to track, nurture, and manage their leads.","CRM, Lead Management, Marketing, SaaS, Sales","30,529",,,4,Late Stage Venture,2022-06-21,11950000000,INR,152940130,Series C,11950000000,INR,152940130,187940130,USD,187940130,Series C,187940130,USD,187940130,"International Finance Corporation, Westbridge Capital, Gaja Capital, Jyoti Bansal, Stakeboat Capital",2011-06-01,day,Active
Huasheng Haoche,https://www.crunchbase.com/organization/huashenghaoche,"Beijing, Beijing, China",Huasheng Haoche is a Beijing-based automotive trading and services platform.,"Automotive, E-Commerce, Service Industry","30,540",,,3,,2024-01-22,650000000,CNY,90356840,Undisclosed,650000000,CNY,90356840,450356840,USD,450356840,Undisclosed,450356840,USD,450356840,"Goldman Sachs, JD Digits, Frees Fund, Crescent Group (Crescent Point), China Minsheng Financial Holdings",2015-01-01,year,Active
ConcertAI,https://www.crunchbase.com/organization/concertai,"Cambridge, Massachusetts, United States",ConcertAI is an AI-powered SaaS data company in healthcare that develops medical research tool in oncology.,"Analytics, Artificial Intelligence (AI), Biotechnology, Oncology, Pharmaceutical, SaaS","30,654",,,2,Late Stage Venture,2022-03-29,150000000,USD,150000000,Series C,150000000,USD,150000000,300000000,USD,300000000,Series C,300000000,USD,300000000,"Sixth Street, SymphonyAI, Maverick Ventures, AllianceBernstein, Declaration Partners",2018-01-01,year,Active
ActiveCampaign,https://www.crunchbase.com/organization/activecampaign,"Chicago, Illinois, United States","ActiveCampaign specializes in email marketing, transactional email, marketing automation, and sales automation.","Apps, Email Marketing, Marketing Automation, Software","30,674",,,3,Late Stage Venture,2021-04-21,240000000,USD,240000000,Series C,240000000,USD,240000000,360000000,USD,360000000,Series C,360000000,USD,360000000,"Dragoneer Investment Group, Susquehanna Growth Equity, Tiger Global Management, Silversmith Capital Partners",2003-01-01,year,Active
B&C Chemical,https://www.crunchbase.com/organization/xuzhou-bokang,"Pizhou, Jiangsu, China","B&C Chemical focuses on the research, development, and production of mid-to-high-end photoresist and related raw materials.","Advanced Materials, Manufacturing, Semiconductor","30,725",,,7,Late Stage Venture,2023-04-19,600000000,CNY,87132048,Series C,600000000,CNY,87132048,900000000,CNY,133434062,Series C,900000000,CNY,133434062,"HNA Group, Xingxiang Yuan, Suzhou International Development Venture Capital, Qingsong Fund, Xin Ding Capital",2010-03-25,day,Active
Payhawk,https://www.crunchbase.com/organization/payhawk,"London, England, United Kingdom","Payhawk unites company cards, expenses, and accounts payable to make business payments easy for everyone.","Financial Services, FinTech, Payments, Software","30,788",,,6,Early Stage Venture,2022-03-01,100000000,USD,100000000,Series B,100000000,USD,100000000,239090120,USD,239090120,Series B,239090120,USD,239090120,"Earlybird Venture Capital, Lightspeed Venture Partners, Tiny VC, Eleven Ventures, Sprints",2018-07-21,day,Active
FourKites,https://www.crunchbase.com/organization/fourkites,"Chicago, Illinois, United States","FourKites is a supply chain visibility platform designed for transportation into yards, warehouses, and stores.","Enterprise Software, Logistics, Machine Learning, Software, Supply Chain Management","30,792",,,8,,2022-09-27,10000000,USD,10000000,Corporate Round,10000000,USD,10000000,241500000,USD,241500000,Corporate Round,241500000,USD,241500000,"Bain Capital Ventures, Qualcomm Ventures, THL, FedEx, Mitsui & Co",2014-01-01,year,Active
VTS,https://www.crunchbase.com/organization/vts,"New York, New York, United States","VTS is a real estate CRM software company bringing together landlords, brokers, and tenants to make deals happen.","Asset Management, Commercial Real Estate, Enterprise Software, Leasing, Professional Services, PropTech, Real Estate, SaaS, Software","30,809",,,11,Late Stage Venture,2022-09-06,125000000,USD,125000000,Series E,125000000,USD,125000000,312360000,USD,312360000,Series E,462360000,USD,462360000,"500 Global, Thrive Capital, Tishman Speyer, Fifth Wall, Bessemer Venture Partners",2012-01-01,year,Active
EcoVadis,https://www.crunchbase.com/organization/ecovadis,"Paris, Ile-de-France, France",EcoVadis offers a collaborative platform that allows companies to assess the environmental and social performance of their suppliers.,"Information Services, Risk Management, Supply Chain Management, Sustainability","30,815",,,8,Late Stage Venture,2022-11-01,,,,Secondary Market,500000000,USD,500000000,733286060,USD,733286060,Series C,735786060,USD,735786060,"BlackRock, Astorg, General Atlantic, GP Bullhound, Partech",2007-04-01,day,Active
Vise,https://www.crunchbase.com/organization/vise-ai,"New York, New York, United States",Vise is an AI-driven investment management platform for financial advisors.,"Artificial Intelligence (AI), Financial Services, FinTech, Insurance, InsurTech","30,829",,,4,Late Stage Venture,2021-05-18,65000000,USD,65000000,Series C,65000000,USD,65000000,128000000,USD,128000000,Series C,128000000,USD,128000000,"Sequoia Capital, Founders Fund, Dorm Room Fund, Contrary, Human Capital",2016-10-01,month,Active
Moon Active,https://www.crunchbase.com/organization/moon-active-ff8c,"Tel Aviv, Tel Aviv, Israel","Moon Active is a game development company focused on iOS, Android and Facebook games.",Gaming,"30,873",,,4,,2021-11-23,300000000,USD,300000000,Secondary Market,,,,,USD,,Venture - Series Unknown,425000000,USD,425000000,"Insight Partners, Vintage Investment Partners, Velo Partners, Andalusian Private Capital, Roy Oron",2011-01-01,year,Active
Shiprocket,https://www.crunchbase.com/organization/shiprocket,"New Delhi, Delhi, India",Shiprocket is an e-commerce shipping platform that enables cost-effective shipping for direct-to-consumer retailers.,"Artificial Intelligence (AI), E-Commerce, Logistics, Shipping, Supply Chain Management","30,965",,,12,Late Stage Venture,2023-10-09,907000000,INR,10892205,Series E,907000000,INR,10892205,399092833,USD,399092833,Series E,399092833,USD,399092833,"Zomato, Gaingels, 500 Global, Razorpay, 9Unicorns Accelerator Fund",2017-01-26,day,Active
Jiedaibao,https://www.crunchbase.com/organization/jiedaibao,"Beijing, Beijing, China",Jiedaibao designs an application that helps in lending and borrowing loans.,"Apps, Finance, Financial Services, FinTech, Lending, Mobile Apps, Personal Finance","30,979",,,2,Early Stage Venture,2016-01-25,2500000000,CNY,380469438,Series B,2500000000,CNY,380469438,4500000000,CNY,693576768,Series B,4500000000,CNY,693576768,,2014-01-01,year,Active
StarkWare Industries,https://www.crunchbase.com/organization/starkware-industries-ltd,"Netanya, HaMerkaz, Israel",StarkWare Industries develops a full-proof stack in generating and verifying proofs of computational integrity in the blockchain.,"Blockchain, Cryptocurrency, Information Technology, Software","30,999",,,6,Late Stage Venture,2022-05-25,100000000,USD,100000000,Series D,100000000,USD,100000000,261000000,USD,261000000,Series D,273000000,USD,273000000,"Sequoia Capital, Polychain, Ethereum Foundation, DCVC, Collaborative Fund",2018-01-01,day,Active
Tongdun Technology,https://www.crunchbase.com/organization/tongdun-technology,"Shenzhen, Guangdong, China",Tongdun Technology is an artificial intelligence-based decision-making intelligence platform.,"FinTech, Internet, Network Security, Software","31,037",,,6,Late Stage Venture,2019-04-25,100000000,USD,100000000,Series D,100000000,USD,100000000,251836983,USD,251836983,Series D,251836983,USD,251836983,"Qiming Venture Partners, Oriza Holdings, IDG Capital, China Merchants Venture Capital, GGV Capital",2013-01-01,year,Active
GupShup,https://www.crunchbase.com/organization/gupshup-technology-india-pvt-ltd,"San Francisco, California, United States",GupShup develops a conversational messaging platform designed to automate business conversations.,"CRM, Information Technology, Messaging","31,106",,,9,Private Equity,2022-05-19,100000000,USD,100000000,Private Equity,100000000,USD,100000000,484130000,USD,484130000,Private Equity,484130000,USD,484130000,"Fidelity, Shane Neman, Tiger Global Management, Tenaya Capital, CRV",2004-01-01,year,Active
Traveloka,https://www.crunchbase.com/organization/traveloka,"Jakarta, Jakarta Raya, Indonesia",Traveloka is an online travel aggregator that helps customers choose and book their next travel location.,"Big Data, In-Flight Entertainment, Search Engine, Travel","31,111",,,8,,2022-09-29,300000000,USD,300000000,Debt Financing,,,,1170000000,USD,1170000000,Corporate Round,1470000000,USD,1470000000,"JD.com, Sequoia Capital, BlackRock, East Ventures, Hillhouse Investment",2012-01-01,year,Active
Axiom Space,https://www.crunchbase.com/organization/axiom-space,"Houston, Texas, United States",Axiom Space is a commercial space station company that connects to the ISS.,"Advanced Materials, Aerospace, Industrial Manufacturing, Space Travel","31,115",,,6,Late Stage Venture,2023-08-21,350000000,USD,350000000,Series C,350000000,USD,350000000,500000000,USD,500000000,Series C,500000000,USD,500000000,"Alumni Ventures, Washington University in St. Louis, Jackson Moses, Disruptive Ventures, Prosperity7 Ventures",2016-01-01,year,Active
NexHealth,https://www.crunchbase.com/organization/nexhealth,"San Francisco, California, United States","NexHealth is a real-time patient booking platform for people, their doctors, and healthcare developers.","Electronic Health Record (EHR), Health Care, Scheduling","31,150",,,9,Late Stage Venture,2022-04-21,125000000,USD,125000000,Series C,125000000,USD,125000000,177151998,USD,177151998,Series C,177151998,USD,177151998,"Banana Capital, Scott Belsky, Jack Altman, DeNA, Buckley Ventures",2016-01-01,year,Active
Devo,https://www.crunchbase.com/organization/logtrust-s-l,"Cambridge, Massachusetts, United States",Devo is a cybersecurity company that provides cloud-native logging and security analytics for organizations.,"Analytics, Big Data, Cloud Data Services, Cyber Security, Information Services, Information Technology","31,216",,,7,Late Stage Venture,2022-06-02,100000000,USD,100000000,Series F,100000000,USD,100000000,481000000,USD,481000000,Series F,481000000,USD,481000000,"TCV, Eurazeo, Bessemer Venture Partners, Insight Partners, General Atlantic",2011-05-01,day,Active
Octopus Energy,https://www.crunchbase.com/organization/octopus-energy,"London, England, United Kingdom",Octopus Energy is a clean energy technology company that provides green energy solutions.,"CleanTech, Energy, Energy Efficiency, GreenTech, Renewable Energy","31,227",,,7,Private Equity,2023-12-18,625000000,GBP,790831917,Private Equity,625000000,GBP,790831917,2869831917,USD,2869831917,Private Equity,2869831917,USD,2869831917,"Canada Pension Plan Investment Board, Generation Investment Management, Origin Energy, Tokyo Gas",2015-10-01,day,Active
Veho,https://www.crunchbase.com/organization/veho-technologies,"Boulder, Colorado, United States",Reinventing delivery and returns for the e-commerce era.,"Delivery, Last Mile Transportation, Same Day Delivery, Shipping","31,287",,,5,Early Stage Venture,2022-02-15,170000000,USD,170000000,Series B,170000000,USD,170000000,299162657,USD,299162657,Series B,299162657,USD,299162657,"Techstars, General Catalyst, Plug and Play, Dorm Room Fund, Industry Ventures",2016-01-01,year,Active
Miaoshou Doctor,https://www.crunchbase.com/organization/miaoshou-doctor,"Beijing, Beijing, China",Miaoshou Doctor is a health care platform that provides communication services between doctors and patients.,"Health Care, Medical, mHealth","31,301",,,7,Late Stage Venture,2021-08-04,1500000000,CNY,231971915,Series F,1500000000,CNY,231971915,946669842,USD,946669842,Series F,946669842,USD,946669842,"Tencent, Sequoia Capital, OrbiMed, CICC, Sequoia Capital China",2015-01-01,year,Active
Roofstock,https://www.crunchbase.com/organization/roofstock,"Oakland, California, United States",Roofstock is an online marketplace for investing in leased single-family rental homes.,"FinTech, Marketplace, PropTech, Real Estate, Rental Property","31,304",,,11,Late Stage Venture,2022-03-10,240000000,USD,240000000,Series E,240000000,USD,240000000,365250000,USD,365250000,Series E,365250000,USD,365250000,"DoorDash, Bain Capital Ventures, Employee Stock Option Fund, Bain Capital, Lightspeed Venture Partners",2015-05-01,month,Active
Picsart,https://www.crunchbase.com/organization/picsart,"Miami, Florida, United States",Picsart is a photo and video editing platform and creative community.,"Generative AI, Graphic Design, Photo Editing, Photography, Software, Video Editing","31,316",,,5,Late Stage Venture,2021-08-26,130000000,USD,130000000,Series C,130000000,USD,130000000,195000000,USD,195000000,Series C,195000000,USD,195000000,"Sequoia Capital, DCM Ventures, Insight Partners, Tribe Capital, G Squared",2011-01-01,year,Active
Beijing Weilan New Energy Technology,https://www.crunchbase.com/organization/beijing-weilan-new-energy-technology,"Beijing, Beijing, China",Beijing Weilan New Energy Technology is an enterprise company focusing on the development of next-generation all-solid-state batteries.,"Battery, Electronics, Energy, Manufacturing","31,318",,,5,Late Stage Venture,2022-11-04,1500000000,CNY,208765361,Series D,1500000000,CNY,208765361,2100000000,CNY,302669072,Series D,2100000000,CNY,302669072,"Shunwei Capital, Huawei Technologies, NIO Capital, Geely, IDG Capital",2016-01-01,year,Active
