TerraPower,https://www.crunchbase.com/organization/terrapower,"Bellevue, Washington, United States",TerraPower focuses on developing a sustainable and economic nuclear energy system while reducing proliferation risks.,"Clean Energy, CleanTech, Energy, Nuclear","38,225",,,4,Early Stage Venture,2022-08-15,750000000,USD,750000000,Series A,750000000,USD,750000000,750000000,USD,750000000,Series A,758550000,USD,758550000,"US Department of Energy, Bill Gates, Hedonova, SK Group, Intellectual Ventures",2006-01-01,year,Active
Nord Security,https://www.crunchbase.com/organization/nord-security,"Vilnius, Vilniaus Apskritis, Lithuania",Nord Security operates as an internet privacy and security provider for individuals and businesses.,"Cyber Security, Network Security, Privacy","38,301",,,2,Private Equity,2023-09-28,100000000,USD,100000000,Private Equity,100000000,USD,100000000,208976979,USD,208976979,Private Equity,208976979,USD,208976979,"Warburg Pincus, General Catalyst, Audrey Capital, Burda Principal Investments, Novator",2012-01-01,year,Active
Naixuecha,https://www.crunchbase.com/organization/naixuecha,"Shenzhen, Guangdong, China","Naixuecha offers tea that insists on providing modern people with a good life experience of ""a cup of good tea and a soft oval.""","Food and Beverage, Food Processing, Hotel, Restaurants, Snack Food","38,470",,,4,Late Stage Venture,2020-12-31,100000000,USD,100000000,Series C,100000000,USD,100000000,215789016,USD,215789016,Series C,215789016,USD,215789016,"PAG, YF Capital, Shenzhen Capital Group, Tiantu Capital",2014-05-01,month,Active
Reify Health,https://www.crunchbase.com/organization/reify-health,"Boston, Massachusetts, United States",Reify Health is a cloud-based software company that develops tools for the clinical trial ecosystem.,"Clinical Trials, Health Care, Software, Software Engineering","38,540",,,7,Late Stage Venture,2022-04-21,220000000,USD,220000000,Series D,220000000,USD,220000000,479300000,USD,479300000,Series D,479630000,USD,479630000,"ICONIQ Growth, Adams Street Partners, Dragoneer Investment Group, Sierra Ventures, Coatue",2012-01-01,year,Active
Xanadu,https://www.crunchbase.com/organization/xanadu-2,"Toronto, Ontario, Canada","Xanadu provides hardware, software, applications, and simulators for quantum computing.","Big Data, Hardware, Quantum Computing, Software","38,542",,,11,Late Stage Venture,2024-02-22,3750000,CAD,2781383,Debt Financing,100000000,USD,100000000,231221647,USD,231221647,Series C,268317736,USD,268317736,"Alumni Ventures, BDC Venture Capital, Creative Destruction Lab (CDL), Radical Ventures, Silicon Valley Bank",2016-09-19,day,Active
Dream Games,https://www.crunchbase.com/organization/dream-games,"Istanbul, Istanbul, Turkey",Dream Games is a mobile game development company that develops mobile puzzle games.,"Casual Games, Gaming, Video Games","38,553",,,4,Late Stage Venture,2022-01-18,255000000,USD,255000000,Series C,255000000,USD,255000000,467500000,USD,467500000,Series C,467500000,USD,467500000,"BlackRock, Index Ventures, Makers Fund, IVP, Kora",2019-01-01,year,Active
TrialSpark,https://www.crunchbase.com/organization/trialspark,"New York, New York, United States",TrialSpark is a technology company that helps bring treatments to patients faster by reimagining how clinical trials are run.,"Biotechnology, Clinical Trials, Health Care","38,663",,,3,Late Stage Venture,2021-09-30,156000000,USD,156000000,Series C,156000000,USD,156000000,156000000,USD,156000000,Series C,156000000,USD,156000000,"Sequoia Capital, Thrive Capital, Section 32, Dragoneer Investment Group, Hyphen Capital",2014-06-01,month,Active
Forte,https://www.crunchbase.com/organization/forte-e22c,"San Francisco, California, United States",Forte is an economic technology for games that powers NFTs and rich token economies.,"Blockchain, Developer Platform, eSports, Gaming, Video Games","38,729",,,4,Early Stage Venture,2021-11-12,725000000,USD,725000000,Series B,725000000,USD,725000000,910000000,USD,910000000,Series B,910000000,USD,910000000,"Animoca Brands, Andreessen Horowitz, Gaingels, PLAYSTUDIOS, Warner Music Group",2019-02-01,month,Active
Ping An Healthcare Management,https://www.crunchbase.com/organization/ping-an-healthcare-management,"Shanghai, Shanghai, China",Ping An Healthcare Management is a medical data collection and analysis business owned by China’s Ping An Insurance Group.,"Data Collection and Labeling, Health Care, Insurance, Medical","38,808",,,1,Early Stage Venture,2018-02-03,1150000000,USD,1150000000,Series A,1150000000,USD,1150000000,1150000000,USD,1150000000,Series A,1150000000,USD,1150000000,"SBI Group, IDG Capital, SoftBank Vision Fund, Hermitage Equity Partners",2005-06-01,month,Active
PayFit,https://www.crunchbase.com/organization/payfit,"Paris, Ile-de-France, France",PayFit offers technology that simplifies and automates payroll and HR processes for small and medium-sized businesses.,"Human Resources, Payments, SaaS, Software","38,980",,,6,Late Stage Venture,2022-01-05,254000000,EUR,287314065,Series E,254000000,EUR,287314065,495751514,USD,495751514,Series E,495751514,USD,495751514,"Bpifrance, Eurazeo, The Family, Kima Ventures, Accel",2015-01-01,year,Active
Snapdeal,https://www.crunchbase.com/organization/snapdeal,"Gurgaon, Haryana, India",Snapdeal is India's leading value e-commerce platform,"E-Commerce, Marketplace","39,032",,,14,,2019-07-23,,,,Venture - Series Unknown,,,,1576260825,USD,1576260825,Venture - Series Unknown,1776260825,USD,1776260825,"Alibaba Group, eBay, Foxconn Technology Group, BlackRock, Nexus Venture Partners",2005-02-04,day,Active
Horizon Robotics,https://www.crunchbase.com/organization/horizon-robotics,"Haidian, Beijing, China",Horizon Robotics is a leading provider of ADAS and AD solutions for passenger vehicles with proprietary software and hardware.,"Autonomous Vehicles, Robotics","39,037",,,12,,2022-09-26,,,,Corporate Round,,,,2200300002,USD,2200300002,Corporate Round,2200300002,USD,2200300002,"BYD Company, SK Hynix, Sequoia Capital, Contemporary Amperex Technology, Vertex Ventures",2015-01-01,year,Active
Kakao Japan,https://www.crunchbase.com/organization/kakao-japan,"Tokyo, Tokyo, Japan",Kakao Japan is a free smartphone calling and messenger application.,"Apps, Content, Messaging, Mobile, Publishing, SNS","39,371",,,3,Private Equity,2021-05-24,60000000000,JPY,551202079,Private Equity,60000000000,JPY,551202079,651616618,USD,651616618,Private Equity,651616618,USD,651616618,"Kakao Corp, Podotree, Yahoo! Japan, Anchor Equity Partners",2011-07-01,day,Active
Copper,https://www.crunchbase.com/organization/copper-05c5,"London, England, United Kingdom",Copper is a cryptocurrency custody firm that provides a secure infrastructure for the institutional digital asset investment community.,"Cryptocurrency, Finance, Financial Exchanges, Financial Services","39,399",,,6,Late Stage Venture,2022-10-12,181000000,USD,181000000,Series C,181000000,USD,181000000,266000000,USD,266000000,Series C,281000000,USD,281000000,"Target Global, Dawn Capital, Accel, Illuminate Financial, Greyhound Capital",2018-01-01,month,Active
Eat Just,https://www.crunchbase.com/organization/just-inc,"San Francisco, California, United States",Eat Just is a food technology company that develops plant-based alternatives to egg and meat products.,"Biotechnology, Food and Beverage, Food Processing, Nutrition, Organic Food","39,497",,,14,,2023-09-01,,,,Venture - Series Unknown,,,,465000000,USD,465000000,Venture - Series Unknown,465000000,USD,465000000,"Hercules Capital, Collaborative Fund, Khosla Ventures, Founders Fund, Horizons Ventures",2011-01-01,year,Active
COSMOplat,https://www.crunchbase.com/organization/cosmoplat,"Shanghai, Shanghai, China",COSMOplat is an online platform that provides industrial internet services.,"Information Technology, Internet, Internet of Things","39,511",,,2,Early Stage Venture,2020-07-28,200000000,CNY,28568163,Series A,200000000,CNY,28568163,1150000000,CNY,162365328,Series A,1150000000,CNY,162365328,"Cowin Capital, SAIF Partners, China Merchants Securities, China Development Bank, China Structural Reform Fund",2017-01-01,year,Active
Omio,https://www.crunchbase.com/organization/omio,"Berlin, Berlin, Germany","Omio offers a multi-mode search tool that compares and combines rail, air, bus, and car for destinations.","Internet, Search Engine, Software, Travel, Travel Accommodations","39,766",,,10,Late Stage Venture,2022-06-20,80000000,USD,80000000,Series E,80000000,USD,80000000,376000000,USD,376000000,Series E,476000000,USD,476000000,"Target Global, Kleiner Perkins, Goldman Sachs Asset Management, Atlantic Labs, Lakestar",2013-01-01,year,Active
Divvy Homes,https://www.crunchbase.com/organization/divvy-homes,"San Francisco, California, United States",Divvy Homes is a tech-enabled real estate platform that facilitates rent-to-own home purchases.,"Financial Services, Real Estate, Rental Property","39,858",,,7,Late Stage Venture,2021-10-12,735000000,USD,735000000,Debt Financing,200000000,USD,200000000,370000000,USD,370000000,Series D,1225000000,USD,1225000000,"Notable Capital, Cross River Bank, Lennar Corporation, Andreessen Horowitz, Caffeinated Capital",2017-01-01,year,Active
Kitopi,https://www.crunchbase.com/organization/kitopi,"Dubai, Dubai, United Arab Emirates",Kitopi is a cloud kitchen startup that provides delivery only services for restaurants.,"Cloud Infrastructure, Delivery, Food and Beverage, Food Delivery, Restaurants","40,266",,,5,Late Stage Venture,2022-05-10,300000000,USD,300000000,Series C,300000000,USD,300000000,804000000,USD,804000000,Series C,804000000,USD,804000000,"Global Ventures, B. Riley Financial, BECO Capital, VentureSouq, Reshape",2018-01-05,day,Active
Upstox,https://www.crunchbase.com/organization/upstox,"Mumbai, Maharashtra, India",Upstox is a fintech company that allows innovative investment options for its users.,"Financial Services, FinTech, Trading Platform","40,478",,,5,Late Stage Venture,2022-09-22,108000000,USD,108000000,Series C,108000000,USD,108000000,143253180,USD,143253180,Series C,143253180,USD,143253180,"BlackSoil, Stride Ventures, Kalaari Capital, InnoVen Capital, Tiger Global Management",2009-01-01,year,Active
CoinSwitch,https://www.crunchbase.com/organization/coinswitch,"Bangalore, Karnataka, India",Making Money Equal for All,"Cryptocurrency, Financial Services, FinTech, Trading Platform","40,649",,,4,Late Stage Venture,2021-10-06,260000000,USD,260000000,Series C,260000000,USD,260000000,300603815,USD,300603815,Series C,300603815,USD,300603815,"Andreessen Horowitz, Coinbase Ventures, Tiger Global Management, Ribbit Capital, Peak XV Partners",2017-06-14,day,Active
Stax,https://www.crunchbase.com/organization/fattmerchant,"Orlando, Florida, United States","Stax is a direct-cost, integrated payment technology provider dedicated to simplify the payment experience for all businesses.","Financial Services, Mobile Payments, Payments, Software, Transaction Processing","40,650",,,5,Late Stage Venture,2022-03-08,245000000,USD,245000000,Series D,245000000,USD,245000000,263250000,USD,263250000,Series D,263250000,USD,263250000,"Greater Sum Ventures, HarbourVest Partners, venVelo, Florida Opportunity Fund, Fulcrum Equity Partners",2014-01-01,year,Active
Caris Life Sciences,https://www.crunchbase.com/organization/caris-life-sciences,"Irving, Texas, United States","Caris Life Sciences is a molecular science company that offers molecular profiling, tissue-based profiling, and testing services.","Biopharma, Biotechnology, Health Care, Life Science","40,675",,,5,Private Equity,2023-01-19,400000000,USD,400000000,Debt Financing,830000000,USD,830000000,1065000000,USD,1065000000,Private Equity,1690000000,USD,1690000000,"Fidelity, Silver Lake, Neuberger Berman, OrbiMed, T. Rowe Price",1996-01-01,year,Active
EverlyWell,https://www.crunchbase.com/organization/everlywell,"Austin, Texas, United States","EverlyWell is a digital health company that offers consumer testing, virtual care, at-home collection tests, and digital results.","Health Care, Medical Device, mHealth, Mobile Apps","40,726",,,7,Late Stage Venture,2021-01-17,75000000,USD,75000000,Secondary Market,175000000,USD,175000000,250000000,USD,250000000,Series D,325000000,USD,325000000,"BlackRock, Portfolia, Foresite Capital, TCG, Lux Capital",2015-08-01,month,Active
Firebolt,https://www.crunchbase.com/organization/firebolt-analytics,"Tel Aviv, Tel Aviv, Israel",Firebolt is a cloud data warehousing platform that allows users to streamline their analytics and access to insights.,"Analytics, Big Data, Cloud Data Services, SaaS, Warehousing","40,751",,,4,Late Stage Venture,2022-01-26,100000000,USD,100000000,Series C,100000000,USD,100000000,264000000,USD,264000000,Series C,264000000,USD,264000000,"Bessemer Venture Partners, K5 Global, Dawn Capital, Angular Ventures, TLV Partners",2019-01-01,year,Active
Infra.Market,https://www.crunchbase.com/organization/infra-market,"Thane, Maharashtra, India",Infra.Market is a Re-Building the Future of Construction through Innovation & Technology,B2B,"40,837",,,13,,2024-01-24,1000000000,INR,12032875,Debt Financing,50000000,USD,50000000,323745747,USD,323745747,Venture - Series Unknown,658679518,USD,658679518,"SK Finance, Vivriti Capital, Nexus Venture Partners, Yubi, IKF Finance",2016-07-15,day,Active
EBANX,https://www.crunchbase.com/organization/ebanx,"Curitiba, Parana, Brazil",EBANX is an integrated financial services company offering an end-to-end payment solution across the entire e-commerce transaction flow.,"E-Commerce, Financial Services, FinTech, Payments","40,840",,,3,Early Stage Venture,2021-06-15,430000000,USD,430000000,Series B,430000000,USD,430000000,460000000,USD,460000000,Series B,460000000,USD,460000000,"FTV Capital, Advent International, Endeavor Catalyst, Bossanova Investimentos",2012-02-01,month,Active
ENOVATE Motors,https://www.crunchbase.com/organization/enovate-motors,"Shanghai, Shanghai, China",ENOVATE Motors is a automobile industry.,"Automotive, Energy, Mobile","40,882",,,3,,2023-03-17,750000000,CNY,108899246,Venture - Series Unknown,750000000,CNY,108899246,7750000000,CNY,1151452254,Venture - Series Unknown,7750000000,CNY,1151452254,,2015-01-01,year,Active
Huikedu Group,https://www.crunchbase.com/organization/huikedu-group,"Beijing, Beijing, China",Huikedu is a Beijing-based education provider which offers higher education and vocational education services and products,"E-Commerce, E-Learning, Education, Higher Education","40,901",,,4,Late Stage Venture,2018-05-24,1500000000,CNY,235198193,Series D,1500000000,CNY,235198193,302195048,USD,302195048,Series D,302195048,USD,302195048,"Fosun RZ Capital, Qianhe Capital, China Oceanwide, Xinlongmai Capital, Beijing Huaruan Jinhong Asset Management",2010-08-01,month,Active
Group14 Technologies,https://www.crunchbase.com/organization/group14-technologies,"Woodinville, Washington, United States",The silicon battery age starts here,"Battery, Chemical Engineering, Electric Vehicle, Energy Storage, Nanotechnology","40,971",,,10,Late Stage Venture,2023-07-20,,,,Series C,,,,649000000,USD,649000000,Series C,756216858,USD,756216858,"US Department of Energy, Lightrock, OMERS Ventures, Decarbonization Partners, BASF Venture Capital",2015-01-01,year,Active
Ryefield Energy,https://www.crunchbase.com/organization/ryefield-energy,"Wenzhou, Zhejiang, China",Ryefield Energy is a manufacturer of inverters and energy storage systems.,"Energy Management, Energy Storage, Renewable Energy","41,029",,,3,,2023-05-28,1000000000,CNY,141548827,Venture - Series Unknown,1000000000,CNY,141548827,1000000000,CNY,141548827,Venture - Series Unknown,2000000000,CNY,283097654,"Zhaoxi Capital, Sparkedge Capital",2019-01-01,year,Active
LeCloud,https://www.crunchbase.com/organization/letv-2,"Beijing, Beijing, China",LeCloud provides professional and leading video cloud services.,"Cloud Computing, Enterprise Software, Software","41,180",,,1,Early Stage Venture,2016-03-04,1000000000,CNY,153388113,Series A,1000000000,CNY,153388113,1000000000,CNY,153388113,Series A,1000000000,CNY,153388113,Chongqing Industry Investment Fund,2004-01-01,year,Active
JLSemi,https://www.crunchbase.com/organization/jlsemi,"Shanghai, Shanghai, China","JLSemi is a manufacturing company that specializes and excels in high-speed Analog, advanced DSP, and mixed-signal designs.","Application Specific Integrated Circuit (ASIC), Manufacturing, Semiconductor","41,182",,,6,Late Stage Venture,2022-07-08,90000000,USD,90000000,Series C,90000000,USD,90000000,90000000,USD,90000000,Series C,90000000,USD,90000000,"Matrix Partners China, CDH Investments, GP Capital, Summitview Capital, Hengxu Capital",2009-01-01,year,Active
Binance,https://www.crunchbase.com/organization/binance,"Valletta, NA - Malta, Malta",Binance is a blockchain ecosystem and digital asset exchange platform that combines digital technology and finance.,"Bitcoin, Cryptocurrency, FinTech, Stock Exchanges, Web3","41,278",,,5,,2018-10-23,,,,Venture - Series Unknown,,,,10000000,ALL,88771,Venture - Series Unknown,10000000,ALL,88771,"ICONIUM, Black Hole Capital, Fundamental Labs, Vertex Ventures Southeast Asia & India, Limitless Crypto Investments",2017-01-01,year,Active
Tenglong Holding Group,https://www.crunchbase.com/organization/tenglong-holding-group,"Beijing, Beijing, China",Tenglong Holding Group provides global distributed data center (IDC) in-depth customization services.,"Data Center, Data Storage","41,295",,,1,Early Stage Venture,2019-12-02,3700000000,USD,3700000000,Series A,3700000000,USD,3700000000,3700000000,USD,3700000000,Series A,3700000000,USD,3700000000,"Morgan Stanley Venture Partners, Huaneng Invesco WLR Investment Consulting, Nanshan Capital, Haitong Hengxin International Leasing",2015-01-01,day,Active
1KMXC,https://www.crunchbase.com/organization/1kmxc,"Hangzhou, Zhejiang, China",1KMXC is a high-tech research and development company for artificial intelligence robot solutions.,"Artificial Intelligence (AI), Machine Learning, Robotics, Service Industry","41,341",,,7,Late Stage Venture,2021-09-01,,,,Series D,,,,86147128,USD,86147128,Series D,86147128,USD,86147128,"Alibaba Group, Goldman Sachs Asset Management, Centurium Capital, Picc Group, Regent Capital",2013-01-01,year,Active
Xpansiv,https://www.crunchbase.com/organization/xpansiv,"San Francisco, California, United States",Xpansiv ingests data sourced from the commodity lifecycle and converts it into intelligent commodities and digital assets.,"Information Technology, IT Infrastructure, Trading Platform","41,441",2019-06-24,day,8,M&A,2023-01-11,125000000,USD,125000000,Private Equity,125000000,USD,125000000,278456000,USD,278456000,Private Equity,678456000,USD,678456000,"Bank of America, S&P Global, Commonwealth Bank of Australia, Goldman Sachs, Macquarie Group",2016-01-01,year,Active
Daily Harvest,https://www.crunchbase.com/organization/daily-harvest,"New York, New York, United States",Daily Harvest is a customer-first platform that provides subscription-based food delivery services to offer healthy frozen foods.,"E-Commerce, Food and Beverage, Food Delivery, Organic Food, Subscription Service","41,702",,,6,Late Stage Venture,2021-11-15,77000000,USD,77000000,Series D,77000000,USD,77000000,120000000,USD,120000000,Series D,120000000,USD,120000000,"Collaborative Fund, Lightspeed Venture Partners, M13, BAM Ventures, Imaginary Ventures",2015-01-01,day,Active
1mg,https://www.crunchbase.com/organization/healthkart-plus,"Gurgaon, Haryana, India",1mg is an online pharmacy network platform and generic medicine engine.,"Delivery, E-Commerce, Health Care, Medical, Pharmaceutical","41,717",2021-06-10,day,16,M&A,2022-09-06,40000000,USD,40000000,Venture - Series Unknown,40000000,USD,40000000,199550209,USD,199550209,Venture - Series Unknown,230800209,USD,230800209,"Sequoia Capital, Bill & Melinda Gates Foundation, International Finance Corporation, Omidyar Network, Tata Digital",2015-02-03,day,Active
Sineva,https://www.crunchbase.com/organization/sineva,"Hefei, Anhui, China","Sineva engages in R&D, manufacturing and sales of transfer robots, test robots, service robots and intelligent factory solutions.","Manufacturing, Robotics, Sales","41,722",2018-09-27,day,5,M&A,2023-06-12,500000000,CNY,69973130,Series D,500000000,CNY,69973130,1700000000,CNY,252898175,Series D,1700000000,CNY,252898175,"CICC, Cowin Capital, Walden International, Hefei Industry Investment Group, BOE Technology Group",2013-07-31,day,Active
Zihaiguo,https://www.crunchbase.com/organization/zihaiguo,"Banan, Chongqing, China",Zihaiguo is a developer and retailer of self-heating hot pots.,"Food and Beverage, Food Processing","41,734",,,5,Late Stage Venture,2021-05-06,100000000,CNY,15469818,Series C,100000000,CNY,15469818,79556309,USD,79556309,Series C,79556309,USD,79556309,"CICC, Meridian Capital Asia, Matrix Partners China, Shenzhen Qianhai Xingwang Investment, Beijing Taikang Investment",2017-08-24,day,Active
Chint Anneng Digital Energy,https://www.crunchbase.com/organization/chint-anneng-digital-energy,"Hangzhou, Zhejiang, China",Chint Anneng is a supplier of renewable energy equipment and solution services aimed at increasing the use of rooftop photovoltaic systems.,Solar,"41,804",,,2,Early Stage Venture,2022-12-01,574800000,USD,574800000,Series B,574800000,USD,574800000,729054335,USD,729054335,Series B,729054335,USD,729054335,"National Green Development Fund, China Southern Power Grid, Zhejiang Silk Road Fund, ICBC Investment, Hangzhoushi Shiye Touzi Jituan Youxian Gongsi",2015-01-01,year,Active
Visby Medical,https://www.crunchbase.com/organization/clickdiagnostics,"San Jose, California, United States",Visby Medical is a diagnostics company that develops PCR-based diagnostic tests for the detection of infectious diseases.,"Health Care, Health Diagnostics, Medical","41,857",,,10,Late Stage Venture,2024-02-08,1800000,USD,1800000,Grant,35000000,USD,35000000,327811564,USD,327811564,Series E,376911564,USD,376911564,"Cedars Sinai, Lightrock, Valo Ventures, J-Ventures, Artiman Ventures",2012-12-01,month,Active
Yidao Yongche,https://www.crunchbase.com/organization/yongche,"Beijing, Beijing, China",Yidao Yongche is a Chinese domestic e-commerce website platform that enables users to book professional car reservation services online.,"Automotive, E-Commerce","42,151",,,7,Private Equity,2018-04-15,,,,Private Equity,,,,790000000,USD,790000000,Private Equity,790000000,USD,790000000,"Trip.com, DCM Ventures, Qualcomm Ventures, LeEco, ZhenFund",2010-01-01,year,Active
Yubi,https://www.crunchbase.com/organization/credavenue,"Chennai, Tamil Nadu, India","Yubi is a fully integrated, unified digital platform that helps discover, trade, execute and fulfill debt solutions for investors.","Finance, Financial Services, FinTech, PaaS","42,153",,,3,Early Stage Venture,2023-07-14,,,,Secondary Market,137000000,USD,137000000,226743955,USD,226743955,Series B,226743955,USD,226743955,"B Capital, CRED, Stride Ventures, Lightrock, Dragoneer Investment Group",2017-01-01,day,Active
T3 Mobile Travel Services,https://www.crunchbase.com/organization/t3-mobile-travel-services,"Nanjing, Jiangsu, China",T3 Mobile Travel Services offers car-sharing services powered by renewable energy.,"Public Transportation, Renewable Energy, Ride Sharing","42,339",,,2,Early Stage Venture,2021-10-29,7700000000,CNY,1202054420,Series A,7700000000,CNY,1202054420,17460000000,CNY,2650329985,Series A,17460000000,CNY,2650329985,"Alibaba Group, Tencent, LY.com, CITIC Capital Holdings, Changan Automobile",2019-03-01,month,Active
Atmosphere,https://www.crunchbase.com/organization/atmosphere-tv,"Austin, Texas, United States","Atmosphere is a streaming TV platform for businesses, offering 21 original and partner TV channels.","Media and Entertainment, TV, Video Streaming","42,441",,,6,Late Stage Venture,2023-02-07,65000000,USD,65000000,Series D,65000000,USD,65000000,193742685,USD,193742685,Series D,213742685,USD,213742685,"Sageview Capital, S3 Ventures, Bridge Bank, Valor Equity Partners, Capstar Capital",2019-01-01,year,Active
Geek+,https://www.crunchbase.com/organization/geek,"Beijing, Beijing, China","Geek+ develops autonomous mobile robots for warehouse, factory, and supply chain management.","Industrial Automation, Logistics, Robotics, Supply Chain Management, Warehouse Automation, Warehousing","42,534",,,9,Late Stage Venture,2022-08-08,100000000,USD,100000000,Series E,100000000,USD,100000000,539441286,USD,539441286,Series E,539441286,USD,539441286,"Warburg Pincus, Vertex Ventures, Gaorong Capital, Intel Capital, GGV Capital",2015-01-01,year,Active
CoinTracker,https://www.crunchbase.com/organization/cointracker,"San Francisco, California, United States",CoinTracker is the gold standard in cryptocurrency portfolio tracking and tax compliance.,"Blockchain, Compliance, Cryptocurrency, Financial Services, FinTech, Software","42,637",,,3,Early Stage Venture,2022-01-27,100000000,USD,100000000,Series A,100000000,USD,100000000,101620000,USD,101620000,Series A,101620000,USD,101620000,"Intuit, Y Combinator, General Catalyst, Stacks, Accel",2017-08-22,day,Active
Turntide Technologies,https://www.crunchbase.com/organization/software-motor-company,"Sunnyvale, California, United States",Turntide Technologies develops an electric motor system designed to drive down energy consumption.,"CleanTech, Electrical Distribution, Energy, Energy Efficiency, GreenTech, Industrial, Industrial Automation, Machinery Manufacturing","42,651",,,10,,2022-06-15,80000000,USD,80000000,Venture - Series Unknown,80000000,USD,80000000,265557518,USD,265557518,Venture - Series Unknown,491529627,USD,491529627,"Breakthrough Energy Ventures, FootPrint Coalition, Fifth Wall, National Science Foundation, Climate Investment",2013-01-01,year,Active
